<?xml version="1.0" encoding="UTF-8" ?>
<?xml-stylesheet type="text/xsl" href="transform.xsl" ?>
<vehicles xmlns:xsi="http://www.w3.org/2001/XMLSchema-instance" xsi:schemaLocation="https://www.vehicles.com/vehicles schema.xsd" xmlns="https://www.vehicles.com/vehicles">
    <vehicle model="Corvette">
        <year>2019</year>
        <make>Chevrolet</make>
    </vehicle>
    <vehicle model="E350">
        <year>1997</year>
        <make>Ford</make>
    </vehicle>
    <vehicle model="Rav4">
        <year>2018</year>
        <make>Toyota</make>
    </vehicle>
</vehicles>